{
  "event_id": "5d1c9a7e-2b4f-4c8d-9e3a-000000000209",
  "event_version": 1,
  "event_type": "aftersales.refund_approved",
  "aggregate_type": "AFTER_SALES_CASE",
  "aggregate_id": 501,
  "sequence": 4,
  "occurred_at": "2026-04-27T10:00:00",
  "correlation_id": "arbitrate-2c7e",
  "idempotency_key": "arbitrate-2c7e",
  "data": {
    "case_id": 501,
    "order_id": 1001,
    "order_no": "7254189912938504192",
    "customer_id": 3,
    "restaurant_id": 1,
    "kind": "CUSTOMER_REQUEST",
    "attempt_no": 1,
    "status": "REFUNDING",
    "action": "ADMIN_APPROVE_PARTIAL",
    "actor_type": "ADMIN",
    "actor_id": 1,
    "version": 3,
    "reason_code": "MISSING_ITEM",
    "description": "The burger was missing from the bag.",
    "requested_amount": 16.09,
    "approved_amount": 6.00,
    "currency": "USD",
    "merchant_decision": "REJECTED",
    "merchant_note": "Everything was in the bag.",
    "resolution": "ARBITRATION_PARTIAL",
    "lines": [
      {
        "order_item_id": 41,
        "menu_item_name": "Whopper Meal",
        "quantity": 1,
        "unit_price": 10.59,
        "amount": 10.59,
        "currency": "USD"
      },
      {
        "order_item_id": 42,
        "menu_item_name": "Large Fries",
        "quantity": 2,
        "unit_price": 2.75,
        "amount": 5.50,
        "currency": "USD"
      }
    ],
    "opened_at": "2026-04-25T13:10:05.120394"
  }
}
