{
  "event_id": "5d1c9a7e-2b4f-4c8d-9e3a-000000000211",
  "event_version": 1,
  "event_type": "aftersales.case_refunded",
  "aggregate_type": "AFTER_SALES_CASE",
  "aggregate_id": 502,
  "sequence": 2,
  "occurred_at": "2026-04-25T12:05:02",
  "correlation_id": "5d1c9a7e-2b4f-4c8d-9e3a-000000000211",
  "data": {
    "case_id": 502,
    "order_id": 1002,
    "order_no": "7254189912938504193",
    "customer_id": 3,
    "restaurant_id": 1,
    "kind": "ORDER_CANCELLED",
    "attempt_no": 1,
    "status": "REFUNDED",
    "action": "REFUND_SUCCEEDED",
    "actor_type": "SYSTEM",
    "version": 1,
    "requested_amount": 16.09,
    "approved_amount": 16.09,
    "refunded_amount": 16.09,
    "currency": "USD",
    "resolution": "ORDER_CANCELLED",
    "lines": [
      {
        "order_item_id": 41,
        "menu_item_name": "Whopper Meal",
        "quantity": 1,
        "unit_price": 10.59,
        "amount": 10.59,
        "currency": "USD"
      },
      {
        "order_item_id": 42,
        "menu_item_name": "Large Fries",
        "quantity": 2,
        "unit_price": 2.75,
        "amount": 5.50,
        "currency": "USD"
      }
    ],
    "opened_at": "2026-04-25T12:05:00.5"
  }
}
