{
  "event_id": "legacy-received-1",
  "event_version": 1,
  "event_type": "merchant.order_received",
  "aggregate_type": "MERCHANT_ORDER",
  "aggregate_id": 1001,
  "occurred_at": "2026-03-01T09:16:00",
  "correlation_id": "checkout-3f9a",
  "data": {
    "order_id": 1001,
    "restaurant_id": 1,
    "paid_at": "2026-04-25T12:01:30.412873",
    "active_merchants": 2
  }
}
