{
  "event_id": "legacy-paid-1",
  "event_version": 1,
  "event_type": "order.paid",
  "aggregate_type": "ORDER",
  "aggregate_id": 1001,
  "occurred_at": "2026-03-01T09:15:00",
  "correlation_id": "checkout-legacy",
  "idempotency_key": "checkout-legacy",
  "data": {
    "customer_id": 3,
    "status": "PAID",
    "total_price": 21.18,
    "created_at": "2026-04-25T12:00:00",
    "items": [
      {
        "id": 41,
        "menu_item_id": 2,
        "restaurant_id": 1,
        "price": 10.59,
        "quantity": 2,
        "menu_item_name": "Whopper Meal",
        "menu_item_description": "Flame-grilled burger, fries and a drink",
        "menu_item_image_url": "https://example.com/whopper.png"
      }
    ]
  }
}
