{
  "event_id": "6a1d2f3c-1b2a-4c5d-8e9f-000000000101",
  "event_version": 1,
  "event_type": "delivery.reassigned",
  "aggregate_type": "DELIVERY",
  "aggregate_id": 77,
  "sequence": 2,
  "occurred_at": "2026-04-25T12:10:00",
  "correlation_id": "6a1d2f3c-1b2a-4c5d-8e9f-000000000101",
  "data": {
    "order_id": 1001,
    "customer_id": 3,
    "restaurant_id": 1,
    "rider_id": 6,
    "status": "ASSIGNED"
  }
}
