{
  "event_id": "0b6f1c2e-6c4e-4f0a-9d4e-000000000205",
  "event_version": 2,
  "event_type": "order.completed",
  "aggregate_type": "ORDER",
  "aggregate_id": 1001,
  "sequence": 5,
  "occurred_at": "2026-04-25T12:40:12.000301",
  "correlation_id": "0b6f1c2e-6c4e-4f0a-9d4e-000000000205",
  "data": {
    "customer_id": 3,
    "status": "COMPLETED",
    "total_price": 21.18,
    "currency": "USD",
    "created_at": "2026-04-25T12:00:00",
    "items": [
      {
        "id": 41,
        "menu_item_id": 2,
        "restaurant_id": 1,
        "price": 10.59,
        "quantity": 2,
        "menu_item_name": "Whopper Meal",
        "menu_item_description": "Flame-grilled burger, fries and a drink",
        "menu_item_image_url": "https://example.com/whopper.png"
      }
    ],
    "restaurant_id": 1,
    "order_no": "7254189912938504192"
  }
}
