{
  "event_id": "5d1c9a7e-2b4f-4c8d-9e3a-000000000203",
  "event_version": 1,
  "event_type": "aftersales.offer_made",
  "aggregate_type": "AFTER_SALES_CASE",
  "aggregate_id": 501,
  "sequence": 2,
  "occurred_at": "2026-04-25T15:42:10",
  "correlation_id": "5d1c9a7e-2b4f-4c8d-9e3a-000000000203",
  "data": {
    "case_id": 501,
    "order_id": 1001,
    "order_no": "7254189912938504192",
    "customer_id": 3,
    "restaurant_id": 1,
    "kind": "CUSTOMER_REQUEST",
    "attempt_no": 1,
    "status": "COUNTER_OFFERED",
    "action": "MERCHANT_OFFER",
    "actor_type": "MERCHANT",
    "actor_id": 21,
    "version": 1,
    "reason_code": "MISSING_ITEM",
    "description": "The burger was missing from the bag.",
    "requested_amount": 16.09,
    "offered_amount": 5.50,
    "currency": "USD",
    "merchant_decision": "OFFERED",
    "merchant_note": "We can refund the fries.",
    "deadline_at": "2026-04-27T15:42:10",
    "lines": [
      {
        "order_item_id": 41,
        "menu_item_name": "Whopper Meal",
        "quantity": 1,
        "unit_price": 10.59,
        "amount": 10.59,
        "currency": "USD"
      },
      {
        "order_item_id": 42,
        "menu_item_name": "Large Fries",
        "quantity": 2,
        "unit_price": 2.75,
        "amount": 5.50,
        "currency": "USD"
      }
    ],
    "opened_at": "2026-04-25T13:10:05.120394"
  }
}
